{
  "productName": "ALBERTAZ",
  "productDescription": "Albert Zhang's personal maker brand and website. It brings together AI engineering, web development, data visualization, visual design, writing, and independent products built in public.",
  "targetAudience": "Developers, designers, independent makers, and people following Albert's products and creative experiments.",
  "personality": "approachable",
  "mascotType": "animal",
  "visualStyle": "A tactile editorial paper sculpture with bold typographic geometry, compact proportions, and a warm handmade finish.",
  "variationCount": 4
}
